{
  "adapters": [
    "angr",
    "build",
    "capstone",
    "clang",
    "clangxx",
    "cmake",
    "container-runtime",
    "coverage",
    "dynamorio",
    "fastapi",
    "gcc",
    "ghidra",
    "gxx",
    "java",
    "javalang",
    "jsonschema",
    "lief",
    "llama-server",
    "lld-link",
    "llvm-lib",
    "llvm-objdump",
    "llvm-readobj",
    "lm-studio",
    "localai",
    "msvc",
    "ninja",
    "objdiff",
    "ollama",
    "pip-audit",
    "pytest",
    "python",
    "pyyaml",
    "unicorn",
    "uvicorn",
    "vllm",
    "z3"
  ],
  "all_function_symbols": [
    "x86decomp.abi:ABIContract.from_dict",
    "x86decomp.abi:analyze_abi",
    "x86decomp.abi:load_abi_contract",
    "x86decomp.abi:validate_abi",
    "x86decomp.analysis_db:AnalysisDatabase.__enter__",
    "x86decomp.analysis_db:AnalysisDatabase.__exit__",
    "x86decomp.analysis_db:AnalysisDatabase.__init__",
    "x86decomp.analysis_db:AnalysisDatabase.accept_constraint",
    "x86decomp.analysis_db:AnalysisDatabase.add_reference",
    "x86decomp.analysis_db:AnalysisDatabase.add_type_constraint",
    "x86decomp.analysis_db:AnalysisDatabase.close",
    "x86decomp.analysis_db:AnalysisDatabase.detect_constraint_conflicts",
    "x86decomp.analysis_db:AnalysisDatabase.ingest_function_artifact",
    "x86decomp.analysis_db:AnalysisDatabase.query",
    "x86decomp.analysis_db:AnalysisDatabase.upsert_entity",
    "x86decomp.angr_backend:_arch_name",
    "x86decomp.angr_backend:_counterexample",
    "x86decomp.angr_backend:_load_angr",
    "x86decomp.angr_backend:_load_memory_harness",
    "x86decomp.angr_backend:_memory_counterexample",
    "x86decomp.angr_backend:_memory_summaries",
    "x86decomp.angr_backend:_summaries",
    "x86decomp.angr_backend:angr_bounded_compare",
    "x86decomp.angr_backend:angr_bounded_compare_files",
    "x86decomp.angr_backend:angr_memory_alias_compare",
    "x86decomp.angr_backend:angr_memory_alias_compare_files",
    "x86decomp.artifacts:function_id_from_rva",
    "x86decomp.artifacts:import_function_artifact",
    "x86decomp.artifacts:validate_function_manifest",
    "x86decomp.artifacts:verify_function_artifact",
    "x86decomp.assembly.annotation:_chunk_comments",
    "x86decomp.assembly.annotation:annotate_source",
    "x86decomp.assembly.annotation:byte_directive_lines",
    "x86decomp.assembly.annotation:parse_byte_directives",
    "x86decomp.assembly.annotation:render_annotated_assembly",
    "x86decomp.assembly.annotation:render_byte_assembly",
    "x86decomp.assembly.annotation:validate_symbol",
    "x86decomp.assembly.cli:_emit",
    "x86decomp.assembly.cli:_int",
    "x86decomp.assembly.cli:_json_array",
    "x86decomp.assembly.cli:_json_file",
    "x86decomp.assembly.cli:build_parser",
    "x86decomp.assembly.cli:dispatch",
    "x86decomp.assembly.cli:main",
    "x86decomp.assembly.materialize:AssemblerError.__init__",
    "x86decomp.assembly.materialize:InstructionCandidate.end",
    "x86decomp.assembly.materialize:_capstone",
    "x86decomp.assembly.materialize:_instruction_candidates",
    "x86decomp.assembly.materialize:_preferred_addresses",
    "x86decomp.assembly.materialize:_render_source",
    "x86decomp.assembly.materialize:_render_source_with_line_map",
    "x86decomp.assembly.materialize:_replace_address_token",
    "x86decomp.assembly.materialize:_safe_symbol",
    "x86decomp.assembly.materialize:_unit_for_offset",
    "x86decomp.assembly.materialize:assemble_coff",
    "x86decomp.assembly.materialize:discover_assembler",
    "x86decomp.assembly.materialize:materialize_function",
    "x86decomp.assembly.materialize:verify_existing_source",
    "x86decomp.assembly.pipeline:AssemblyPipeline.__init__",
    "x86decomp.assembly.pipeline:AssemblyPipeline.batch",
    "x86decomp.assembly.pipeline:AssemblyPipeline.list_runs",
    "x86decomp.assembly.pipeline:AssemblyPipeline.report",
    "x86decomp.assembly.pipeline:_function_bytes",
    "x86decomp.assembly.pipeline:_load_json",
    "x86decomp.assembly.pipeline:_resolve_path",
    "x86decomp.assembly.pipeline:_symbol_map",
    "x86decomp.assembly.relocations:RelocationResolver.inspect",
    "x86decomp.assembly.relocations:RelocationResolver.resolve",
    "x86decomp.assembly.relocations:SymbolAddress.safe_name",
    "x86decomp.assembly.relocations:SymbolAddress.to_dict",
    "x86decomp.assembly.relocations:_compute_value",
    "x86decomp.assembly.relocations:_object_symbol_target",
    "x86decomp.assembly.relocations:_read_addend",
    "x86decomp.assembly.relocations:_resolve_target",
    "x86decomp.assembly.relocations:_write_value",
    "x86decomp.assembly.relocations:normalize_symbol_map",
    "x86decomp.assembly.relocations:supported_relocations",
    "x86decomp.assembly.store:AssemblyStore.check",
    "x86decomp.assembly.store:AssemblyStore.decode",
    "x86decomp.assembly.store:AssemblyStore.initialize",
    "x86decomp.benchmarks:_resolve",
    "x86decomp.benchmarks:classification_metrics",
    "x86decomp.benchmarks:run_benchmark_corpus",
    "x86decomp.canonical:_group_parsers",
    "x86decomp.canonical:_leaf_parsers",
    "x86decomp.canonical:_route_owner",
    "x86decomp.canonical:_source_parsers",
    "x86decomp.canonical:_subparsers",
    "x86decomp.canonical:build_parser",
    "x86decomp.canonical:canonical_groups",
    "x86decomp.canonical:canonical_routes",
    "x86decomp.canonical:command_catalog",
    "x86decomp.canonical:dispatch",
    "x86decomp.canonical:main",
    "x86decomp.canonical:register_canonical_commands",
    "x86decomp.cli:_build_parser",
    "x86decomp.cli:_int",
    "x86decomp.cli:_json_object",
    "x86decomp.cli:_mcp_client",
    "x86decomp.cli:_path",
    "x86decomp.cli:_print",
    "x86decomp.cli:_run",
    "x86decomp.cli:main",
    "x86decomp.coff:CoffObject.architecture",
    "x86decomp.coff:CoffObject.find_symbols",
    "x86decomp.coff:CoffObject.section",
    "x86decomp.coff:CoffObject.symbol_by_index",
    "x86decomp.coff:CoffObject.to_dict",
    "x86decomp.coff:CoffRelocation.to_dict",
    "x86decomp.coff:CoffRelocation.width",
    "x86decomp.coff:CoffSection.alignment",
    "x86decomp.coff:CoffSection.alignment_power",
    "x86decomp.coff:CoffSection.comdat_selection_name",
    "x86decomp.coff:CoffSection.is_comdat",
    "x86decomp.coff:CoffSection.to_dict",
    "x86decomp.coff:CoffSymbol.function_definition",
    "x86decomp.coff:CoffSymbol.is_function",
    "x86decomp.coff:CoffSymbol.section_definition",
    "x86decomp.coff:CoffSymbol.to_dict",
    "x86decomp.coff:CoffSymbol.weak_external",
    "x86decomp.coff:ComdatCandidate.to_dict",
    "x86decomp.coff:ComdatResolution.to_dict",
    "x86decomp.coff:ComdatResolution.valid",
    "x86decomp.coff:ExtractedSymbol.to_dict",
    "x86decomp.coff:FileAux.to_dict",
    "x86decomp.coff:FunctionDefinitionAux.to_dict",
    "x86decomp.coff:RawAux.to_dict",
    "x86decomp.coff:SectionDefinitionAux.selection_name",
    "x86decomp.coff:SectionDefinitionAux.to_dict",
    "x86decomp.coff:WeakExternalAux.to_dict",
    "x86decomp.coff:_Reader.__init__",
    "x86decomp.coff:_Reader.require",
    "x86decomp.coff:_Reader.unpack",
    "x86decomp.coff:_decode_section_name",
    "x86decomp.coff:_decode_symbol_name",
    "x86decomp.coff:_encode_name",
    "x86decomp.coff:_parse_auxiliary_records",
    "x86decomp.coff:_parse_header",
    "x86decomp.coff:_read_addend",
    "x86decomp.coff:_read_string_table",
    "x86decomp.coff:_section_aux_bytes",
    "x86decomp.coff:_string_at",
    "x86decomp.coff:build_comdat_coff",
    "x86decomp.coff:build_synthetic_coff",
    "x86decomp.coff:build_synthetic_coff_object",
    "x86decomp.coff:collect_comdat_candidates",
    "x86decomp.coff:extract_symbol",
    "x86decomp.coff:parse_coff",
    "x86decomp.coff:parse_coff_bytes",
    "x86decomp.coff:relocation_is_pc_relative",
    "x86decomp.coff:relocation_name",
    "x86decomp.coff:relocation_width",
    "x86decomp.coff:resolve_comdats",
    "x86decomp.coff:synthetic_symbol_indices",
    "x86decomp.coff:write_synthetic_coff",
    "x86decomp.coff:write_synthetic_coff_object",
    "x86decomp.coff_archive:ArchiveMember.to_dict",
    "x86decomp.coff_archive:CoffArchive.to_dict",
    "x86decomp.coff_archive:_cstring_sequence",
    "x86decomp.coff_archive:_decimal",
    "x86decomp.coff_archive:_first_linker_symbols",
    "x86decomp.coff_archive:_long_name",
    "x86decomp.coff_archive:_octal",
    "x86decomp.coff_archive:_parse_import_object",
    "x86decomp.coff_archive:_second_linker_symbols",
    "x86decomp.coff_archive:parse_coff_archive",
    "x86decomp.coff_archive:parse_coff_archive_bytes",
    "x86decomp.compiler:_resolve_executable",
    "x86decomp.compiler:_tool_version",
    "x86decomp.compiler:compiler_cache_key",
    "x86decomp.compiler:load_profile",
    "x86decomp.compiler:run_compiler_profile",
    "x86decomp.compiler_lab:_variant_arguments",
    "x86decomp.compiler_lab:run_compiler_lab",
    "x86decomp.compiler_worker:run_compiler_worker",
    "x86decomp.content_store:ContentStore.__init__",
    "x86decomp.content_store:ContentStore._locked",
    "x86decomp.content_store:ContentStore._paths",
    "x86decomp.content_store:ContentStore._validate_digest",
    "x86decomp.content_store:ContentStore.add_reference",
    "x86decomp.content_store:ContentStore.export_index",
    "x86decomp.content_store:ContentStore.garbage_collect",
    "x86decomp.content_store:ContentStore.get",
    "x86decomp.content_store:ContentStore.put_bytes",
    "x86decomp.content_store:ContentStore.put_file",
    "x86decomp.content_store:ContentStore.read_bytes",
    "x86decomp.content_store:ContentStore.referenced_digests",
    "x86decomp.content_store:ContentStore.remove_reference",
    "x86decomp.content_store:ContentStore.verify",
    "x86decomp.content_store:StoredArtifact.to_dict",
    "x86decomp.contracts:atomic_write_bytes",
    "x86decomp.contracts:atomic_write_json",
    "x86decomp.contracts:canonical_json",
    "x86decomp.contracts:dedupe_preserve",
    "x86decomp.contracts:ensure_relative_path",